{
  "$schema": "https://json-schema.org/draft/2020-12/schema",
  "$id": "https://praxis.chatman.io/schemas/admission_table_scenario.schema.json",
  "title": "Admission table scenario",
  "description": "Chatman engine acceptance/falsification scenario. The expected_refusal enum mirrors Refusal::name() in crates/praxis-graphlaw/src/chatman/abi.rs exactly; tests/chatman_static_gates.rs asserts set-equality.",
  "type": "object",
  "required": [
    "case",
    "kind",
    "seed",
    "input"
  ],
  "additionalProperties": false,
  "properties": {
    "case": {
      "type": "string",
      "minLength": 1,
      "description": "Unique scenario identifier (kebab-case)."
    },
    "kind": {
      "enum": [
        "acceptance",
        "falsification"
      ],
      "description": "acceptance: input must be admitted; falsification: input must be refused with expected_refusal."
    },
    "seed": {
      "type": "integer",
      "minimum": 0,
      "description": "Deterministic seed; same seed => same bytes."
    },
    "mutation": {
      "type": "string",
      "description": "Optional named mutation applied to the acceptance base case to produce this falsification case."
    },
    "expected_refusal": {
      "enum": [
        "ValidationFailed",
        "PlanInfeasible",
        "TraceUnlawful",
        "HookUnpermitted",
        "MissingReceipt",
        "SnapshotNotFound",
        "BoundaryRequestMissingReceipt",
        "Triple8UniverseOverflow",
        "TermNotInTriple8Universe",
        "ProfileSymbolTableMismatch",
        "ProjectionHashMismatch",
        "WarmPathRequired",
        "AdmissionTableMismatch",
        "HookPatternNotAdmitted",
        "OcelEventNotAdmitted",
        "LeastExpressiveRouteViolation",
        "UnsupportedDialect",
        "N3UnavailableByProfile",
        "N3ActuationRefused",
        "RouteDecisionMismatch",
        "GraphSnapshotMismatch",
        "ProfileHashMismatch",
        "AgentOverrideDenied",
        "WitnessNotAuthority",
        "BreedUnpermitted",
        "NondeterministicOperatorRequiresReceipt",
        "ProcessReceiptShadowType",
        "DuplicateCanonicalTapeType",
        "TripleTermInSnapshot"
      ],
      "description": "Required for kind=falsification: the Refusal::name() value the engine must return."
    },
    "expected_behavior": {
      "type": "string",
      "description": "Human-readable statement of the admitted behavior (kind=acceptance)."
    },
    "input": {
      "description": "Admission table identity and entry input.",
      "type": "object",
      "required": [
        "table_hash",
        "entries"
      ],
      "additionalProperties": false,
      "properties": {
        "table_hash": {
          "type": "string",
          "pattern": "^[0-9a-f]{64}$",
          "description": "Carried table identity; the engine recomputes it from sorted entries and refuses on mismatch."
        },
        "entries": {
          "type": "array",
          "items": {
            "type": "object",
            "required": [
              "pattern",
              "admitted"
            ],
            "additionalProperties": false,
            "properties": {
              "pattern": {
                "type": "string",
                "minLength": 1
              },
              "admitted": {
                "type": "boolean"
              }
            }
          }
        }
      }
    }
  },
  "allOf": [
    {
      "if": {
        "properties": {
          "kind": {
            "const": "falsification"
          }
        }
      },
      "then": {
        "required": [
          "expected_refusal"
        ]
      }
    },
    {
      "if": {
        "properties": {
          "kind": {
            "const": "acceptance"
          }
        }
      },
      "then": {
        "required": [
          "expected_behavior"
        ]
      }
    }
  ]
}
