{
  "case": "Falsify_OcelEventNotAdmitted",
  "kind": "falsification",
  "seed": 3249041864728186939,
  "mutation": "Submit an OCEL event whose activity name is absent from the admission table.",
  "expected_refusal": "OcelEventNotAdmitted",
  "input": {"table_hash":"0edfb0856638e5556934c094ad4c0a5efde9cff24c8a989fa959af1fae1345f0","entries":[{"pattern":"ocel-event-a","admitted":true},{"pattern":"ocel-event-b","admitted":false}]}
}
